{
  "$schema": "./skill-rules.schema.json",
  "version": "1.0",
  "defaults": {
    "weights": {
      "keyword": 2,
      "pattern": 3,
      "directory": 5,
      "intent": 4,
      "filePath": 4,
      "content": 3
    },
    "_weightDocs": {
      "keyword": "Exact word match in prompt (lowest — common words cause noise)",
      "pattern": "Regex match (medium — more precise than keywords)",
      "directory": "CWD matches trigger directory (highest — strong signal)",
      "intent": "Semantic intent detection (medium-high — 'debug', 'create', etc.)",
      "filePath": "File extension match in prompt (medium-high — specific to skill)",
      "content": "File content pattern match (medium — planned, not yet wired)"
    },
    "threshold": 25
  },
  "rules": [
    {
      "skill": "CreateSkill",
      "type": "proactive",
      "enforcement": "suggest",
      "priority": 8,
      "triggers": {
        "keywords": ["skill", "hook", "workflow", "extend", "plugin"],
        "patterns": [
          "(create|add|build|make|new).*(skill|hook|workflow)",
          "(skill|hook|workflow).*(create|add|build|make|new)",
          "how (do|to).*(add|create).*(skill|hook)"
        ],
        "intents": ["extend", "create"],
        "directories": ["skills/", "hooks/"]
      },
      "suggestion": "Use CreateSkill to scaffold a new skill with the correct structure"
    },
    {
      "skill": "_ExampleNotes",
      "type": "proactive",
      "enforcement": "suggest",
      "priority": 1,
      "triggers": {
        "keywords": ["note", "capture", "jot", "remember"],
        "patterns": ["(take|make|write).*(note|memo)"],
        "intents": ["capture"]
      },
      "suggestion": "Example skill — replace with your own. See CUSTOMIZE.md"
    }
  ],
  "exclusions": {
    "prefixes": [
      "/", "hi", "hello", "hey", "thanks", "thank you", "ok", "okay",
      "yes", "no", "sure", "bye", "good", "great", "nice", "cool",
      "sounds good", "perfect", "got it", "understood", "makes sense",
      "yep", "nope", "nah", "right", "wrong", "true", "false"
    ],
    "patterns": [
      "^(go ahead|proceed|continue|just do it|do it|looks good|lgtm)$",
      "^\\d+$",
      "^[a-c]$"
    ]
  },
  "settings": {
    "maxSuggestions": 3,
    "showScores": false,
    "_scoreDocs": "Set showScores to true to see normalized scores in suggestions. Useful for tuning thresholds and weights during development."
  }
}
